"Bug ID","Product","Component","Assignee","Status","Resolution","Summary","Changed"
582935,"Incubator","e4","eclipse.e4-inbox","NEW"," ---","Cannot update eclipse to the latest version after filling eclipse URL - address garbled","2024-02-14 05:05:29"
582963,"Incubator","e4","eclipse.e4-inbox","NEW"," ---","Eclipse 2023-12 suddenly, without explanation, becomes unresponsive and no longer works","2024-02-23 09:16:55"
442203,"Ice","Core","ice-inbox","NEW"," ---","Initial Contribution - Eclipse ICE","2014-08-20 14:49:40"
450681,"Ice","Core","ice-inbox","NEW"," ---","Build Materials Database and Reflectivity Calculator","2015-01-12 14:37:58"
454803,"Ice","Core","ice-inbox","NEW"," ---","Enhanced MOOSE post-processing support","2015-05-01 14:59:06"
455803,"Ice","General","ice-inbox","NEW"," ---","Feature Request: Create or find a color map widget","2014-12-20 18:16:37"
456144,"Ice","Core","ice-inbox","NEW"," ---","IOService not available in setupForm","2014-12-24 10:14:26"
456827,"Ice","General","ice-inbox","NEW"," ---","JobLaunchers throw IllegalThreadStateException","2015-01-15 15:02:25"
457750,"Ice","General","ice-inbox","NEW"," ---","ICE UI components need to be tested","2015-06-22 18:13:54"
457764,"Ice","Core","ice-inbox","NEW"," ---","Adding a fileset causes VizFileViewer to throw NullPointerException","2015-01-16 18:37:58"
458061,"Ice","Core","ice-inbox","NEW"," ---","XML files of persisted Items not deleted immediately","2015-01-21 11:18:09"
461332,"Ice","General","ice-inbox","NEW"," ---","Tie items to external processes that they spawn","2015-03-03 14:52:00"
461341,"Ice","General","ice-inbox","NEW"," ---","Job Launcher Form displays ""Processing Form..."" even after cancel button has been pressed.","2015-03-03 17:07:34"
466108,"Ice","Core","ice-inbox","NEW"," ---","MOOSE Launcher - Duplicate Resources","2015-05-01 15:12:41"
467900,"Ice","General","ice-inbox","NEW"," ---","EntryComposite UI Tests","2015-05-21 12:32:46"
469212,"Ice","General","ice-inbox","NEW"," ---","About ICE Page Blank","2015-06-02 18:57:36"
469215,"Ice","General","ice-inbox","NEW"," ---","On Ubuntu/Unity menu items do not appear when clicked.","2015-06-02 19:05:08"
470918,"Ice","Core","ice-inbox","NEW"," ---","VisIt Plug-ins - Performance degradation with GB-sized meshes","2015-07-23 17:52:24"
470919,"Ice","Core","ice-inbox","NEW"," ---","VisIt Plug-ins - Error handling needs to be improved","2015-07-23 17:52:39"
471602,"Ice","Core","ice-inbox","NEW"," ---","Fedora 22 bug- pixman error","2018-04-19 03:25:37"
471972,"Ice","Core","ice-inbox","NEW"," ---","Reflectivity model needs to accept data","2015-07-06 16:17:28"
471973,"Ice","Core","ice-inbox","NEW"," ---","Reflectivity model should always calculate RQ4","2015-07-06 16:28:26"
471974,"Ice","Core","ice-inbox","NEW"," ---","Add a template material to the materials database","2015-07-06 16:30:07"
471975,"Ice","Core","ice-inbox","NEW"," ---","Enable Custom Names for Reflectivity Model items","2015-07-06 16:34:02"
471977,"Ice","Core","ice-inbox","NEW"," ---","Update submitForm in Reflectivity Model to draw the data as soon as the user selects the data file","2015-07-06 16:41:27"
471978,"Ice","Core","ice-inbox","NEW"," ---","Enable sharing for Reflectivity Model data","2015-07-06 16:46:58"
471979,"Ice","Core","ice-inbox","NEW"," ---","Enable item generation via a copy option","2015-07-06 16:48:45"
471980,"Ice","Core","ice-inbox","NEW"," ---","Reflectivity Team has requested project support","2015-07-06 16:51:38"
471981,"Ice","General","ice-inbox","NEW"," ---","Reflectivity Model needs new UI layout","2015-07-06 16:53:28"
471982,"Ice","Core","ice-inbox","NEW"," ---","Reflectivity model needs to not accept bad values for the entry parameters","2015-07-06 16:57:06"
471983,"Ice","Core","ice-inbox","NEW"," ---","Reflectivity Model add constraints to layer table","2015-07-06 16:58:52"
471984,"Ice","Website","ice-inbox","NEW"," ---","Reflectivity Tutorial- cite SNS support and testing and add cite documentation","2015-07-06 17:02:52"
473442,"Ice","Core","ice-inbox","NEW"," ---","VisItVizService bugs and requests","2015-07-24 12:31:02"
475730,"Ice","Core","ice-inbox","NEW"," ---","CSV Plot Editor temporarily disables project explorer","2015-08-24 11:29:22"
478420,"Ice","Core","ice-inbox","NEW"," ---","MOOSE Workflows accept non-integer thread numbers","2015-09-25 10:32:22"
481764,"Ice","Core","ice-inbox","NEW"," ---","Binary issues for JavaFX Geometry Editor implementation","2015-11-09 14:46:50"
481776,"Ice","Core","ice-inbox","NEW"," ---","Error opening JavaFX Geometry Editor on Windows","2015-11-09 15:46:13"
481780,"Ice","Core","ice-inbox","NEW"," ---","JavaFX Geometry Editor shape clipping issue","2015-11-09 15:53:19"
481783,"Ice","Core","ice-inbox","NEW"," ---","JavaFX Geometry Editor feature enhancements","2015-11-09 16:01:29"
482729,"Ice","General","ice-inbox","NEW"," ---","Weird Visit behavior, existing connection fails","2016-02-20 13:03:15"
482732,"Ice","Core","ice-inbox","NEW"," ---","CSV Plot Editor freezes","2015-11-20 16:21:23"
496586,"Ice","General","ice-inbox","NEW"," ---","Demo bug report for ORNL Eclipse Users Group","2016-06-22 15:35:52"
457284,"Ice","Core","jayjaybillings","NEW"," ---","Update Reflectivity model to create ResourceComponent when processing","2015-05-26 10:47:47"
472972,"Ice","Core","jayjaybillings","NEW"," ---","Add missing bundles to feature","2015-07-17 14:57:48"
480601,"Ice","General","jayjaybillings","NEW"," ---","EntryComposite Browse button does not correctly set file path","2015-10-26 09:36:49"
480711,"Ice","General","jayjaybillings","NEW"," ---","Materials database not showing up in Reflectivity UI","2015-10-26 21:39:17"
482170,"Ice","Core","jayjaybillings","NEW"," ---","ICE 2.2 Release Candidate 1","2015-12-28 14:35:10"
454953,"Ice","General","jordan.deyton","NEW"," ---","Plant - Invalid PlantComponent properties can cause the 3D plant view to crash","2014-12-11 17:22:00"
457389,"Ice","Core","jordan.deyton","NEW"," ---","VisItVizService control and feature enhancements","2015-07-24 12:31:02"
458053,"Ice","General","jordan.deyton","NEW"," ---","Plant - Keyboard controls sometimes do not function continuously","2015-01-21 13:20:34"
460154,"Ice","Core","jordan.deyton","NEW"," ---","Properties View - File Entries should have a drop-down and/or a browse button to select files.","2015-07-24 12:25:23"
465740,"Ice","Core","jordan.deyton","NEW"," ---","VizService Tests - These need to be fleshed out significantly","2015-04-28 17:55:15"
465741,"Ice","Core","jordan.deyton","NEW"," ---","CSVVizService - Update the Tests","2015-04-28 17:54:17"
465742,"Ice","Core","jordan.deyton","NEW"," ---","VisItVizService -  Update the Tests","2015-07-24 12:30:04"
466101,"Ice","Core","jordan.deyton","NEW"," ---","ICE Documentation - Validate/Update dating of license terms for all files.","2015-05-01 14:03:30"
466104,"Ice","Core","jordan.deyton","NEW"," ---","ICE Documentation - Update authors/contributors in source file licenses","2015-05-01 14:27:12"
468390,"Ice","Core","jordan.deyton","NEW"," ---","Adding New Series to a CSV Embedded Plot","2015-08-05 14:40:45"
468393,"Ice","Core","jordan.deyton","NEW"," ---","Automatic VisIt Startup Through Installer and Program Argument","2015-07-23 17:57:02"
470750,"Ice","Core","jordan.deyton","NEW"," ---","VisItVizService - Time slider widget needs actual times, not timestep indices","2015-07-23 17:49:02"
470751,"Ice","Core","jordan.deyton","NEW"," ---","VisItVizService - Setting a specific timestep","2015-07-23 17:49:21"
472211,"Ice","Core","jordan.deyton","NEW"," ---","ParaViewVizService - UI Enhancements","2015-09-11 10:55:49"
473434,"Ice","Core","jordan.deyton","NEW"," ---","ParaViewVizService bugs and requests","2015-08-27 16:10:02"
473436,"Ice","Core","jordan.deyton","NEW"," ---","ParaViewVizService bug - Timestep mismatch after rendering file","2015-07-23 16:13:57"
473437,"Ice","Core","jordan.deyton","NEW"," ---","ParaViewWebClient bug - Can't set to specific timestep","2015-07-23 16:18:29"
473438,"Ice","Core","jordan.deyton","NEW"," ---","ParaViewWebClient bug - Times reported for previously opened files","2015-07-23 16:30:52"
473522,"Ice","Core","jordan.deyton","NEW"," ---","ParaViewWebClient bug - Needs to be able to launch a remote server","2015-07-24 12:03:18"
473523,"Ice","Core","jordan.deyton","NEW"," ---","ParaViewWebClient request - Support for Windows hosts","2015-07-24 12:06:54"
473525,"Ice","Core","jordan.deyton","NEW"," ---","ParaViewVizService request - Python console for interacting with plots","2015-07-24 12:15:55"
474740,"Ice","Core","jordan.deyton","NEW"," ---","ICE Reactor Perspective - Fixes and Improvements","2015-08-11 16:14:05"
474743,"Ice","Core","jordan.deyton","NEW"," ---","Double-clicking a Reactor in the Reactors View not working","2015-08-11 16:08:30"
476076,"Ice","Core","jordan.deyton","NEW"," ---","ParaViewMouseAdapter bug - Responds to selections in the context Menu","2015-08-27 16:05:35"
476077,"Ice","Core","jordan.deyton","NEW"," ---","IParaViewWebClient request - Make it extensible via OSGi","2015-08-27 16:10:02"
476078,"Ice","General","jordan.deyton","NEW"," ---","ICE Plot Editor bug - Visualization Service selection dialog text is too wide","2016-02-12 16:30:42"
474451,"Ice","Core","kaspergam","NEW"," ---","Contour mapping no longer available with CSV plots in ICE","2015-08-06 16:40:37"
478194,"Ice","Core","amccaskey2223","ASSIGNED"," ---","Installing ICE from the install fails on Macbook Pro","2015-09-30 11:38:41"
470743,"Ice","Core","jayjaybillings","ASSIGNED"," ---","Stoichiometry Still needs implementing","2015-06-22 15:23:53"
480522,"Ice","General","jayjaybillings","ASSIGNED"," ---","IJAXBClassProvider tester fails in the build","2015-10-23 13:02:01"
455654,"Ice","General","jordan.deyton","ASSIGNED"," ---","MOOSE - Selecting from pre-defined list when adding new parameters to blocks","2015-07-06 14:45:05"
457293,"Ice","Core","jordan.deyton","ASSIGNED"," ---","Generate script to go through ICE code and fix documentation","2015-05-21 14:11:06"
457388,"Ice","Core","jordan.deyton","ASSIGNED"," ---","VisItVizService preference enhancements","2015-07-24 12:31:15"
464170,"Ice","Core","jordan.deyton","ASSIGNED"," ---","VisItPlot - Different plot renderings use the same VisItSwtWidget window IDs","2015-07-24 12:24:54"
465743,"Ice","Core","jordan.deyton","ASSIGNED"," ---","VizService Tests - Update connection-related tests","2015-04-29 11:25:27"
467906,"Ice","Core","jordan.deyton","ASSIGNED"," ---","ICE Documentation - Generate Javadoc","2015-06-25 16:07:16"
468388,"Ice","Core","jordan.deyton","ASSIGNED"," ---","TimeSlider Widget on Embedded Viz Views","2015-07-23 17:49:21"
468394,"Ice","Core","jordan.deyton","ASSIGNED"," ---","Disable Secure Storage Popup for Local VisIt Connections","2015-07-24 11:36:29"
468400,"Ice","Core","jordan.deyton","ASSIGNED"," ---","MOOSE Perspective Improvements","2015-06-23 08:57:08"
469997,"Ice","General","jordan.deyton","ASSIGNED"," ---","Visualization Service - Refactor/Updates to better handle multiple connections","2015-07-23 17:15:55"
471619,"Ice","Core","jordan.deyton","ASSIGNED"," ---","ParaViewVizService -  Implement a visualization service powered by ParaView","2015-07-23 16:10:55"
471968,"Ice","Core","jordan.deyton","ASSIGNED"," ---","ICE - ""Script Unit Test"" view is now a part of every perspective","2015-07-06 18:58:23"
473691,"Ice","Core","jordan.deyton","ASSIGNED"," ---","CSVPlot bug - Series' enabled state inconsistency","2015-08-05 14:59:42"
474744,"Ice","Core","jordan.deyton","ASSIGNED"," ---","Reactor HDF infrastructure updates","2015-09-02 10:34:11"
478471,"Ice","General","jskim910118","ASSIGNED"," ---","Transform ICE client OSGi services into extensions(IFormWidgetBuilder)","2015-09-26 16:34:57"
478470,"Ice","Core","nickstanish","ASSIGNED"," ---","ItemBuilder OSGI service needs to be extension point","2015-09-26 16:44:20"
479184,"Ice","Core","nickstanish","ASSIGNED"," ---","IJAXBClassProvider and ICompositeItemBuilder should use extension registry","2015-10-23 12:18:34"
482530,"Ice","General","smithrw","ASSIGNED"," ---","In the Visualization perspective, after adding plots for one file, and then another,plots for the first added one can't be displayed","2016-01-18 17:06:45"
479587,"Ice","Core","tmccrary","ASSIGNED"," ---","Replace JME geometry editor implementation with JavaFX","2015-10-16 21:39:55"
581768,"Incubator","e4","eclipse.e4-inbox","REOPENED"," ---","std::distance flags invalid arguments in c++ 20 but still compiles and runs","2023-04-03 16:10:12"
581323,"Jakartaee-stable","General","wst-inbox","REOPENED"," ---","illegal reflective access in com.sun.xml.bind plugin","2023-01-25 01:02:38"
468384,"Ice","Core","amccaskey2223","RESOLVED","FIXED","Integrate Existing MOOSE Items Into A New CompositeItem Subclass","2015-06-18 13:38:20"
468386,"Ice","Core","amccaskey2223","RESOLVED","FIXED","Improve MOOSE Tools to Hide YAML Application Data","2015-06-18 13:40:15"
468397,"Ice","Core","amccaskey2223","RESOLVED","FIXED","Create MOOSE Output Subclass that Wraps ICE Updater","2015-06-18 13:44:26"
468407,"Ice","Core","amccaskey2223","RESOLVED","FIXED","Create a Moose IProjectNature","2015-07-07 11:31:36"
470201,"Ice","Core","amccaskey2223","RESOLVED","FIXED","""type"" parameter in Moose tree must be required and checked","2015-06-15 13:11:45"
470819,"Ice","Core","amccaskey2223","RESOLVED","FIXED","Launching MOOSE Item loaded from Item Viewer fails","2015-07-07 11:32:09"
460852,"Ice","General","bennettar","RESOLVED","DUPLICATE","No procedure to stop hanging CAEBAT simulations","2015-03-03 14:51:59"
222678,"Incubator","e4","bokowski","RESOLVED","WORKSFORME","Problems view does not have content when opened the first time","2019-09-04 01:57:58"
222679,"Incubator","e4","bokowski","RESOLVED","WORKSFORME","Problems view leaks listener","2019-09-04 01:57:59"
307551,"Incubator","e4","bokowski","RESOLVED","INVALID","please ignore (testing)","2019-09-02 14:56:07"
470425,"Ice","Website","denis.roy","RESOLVED","FIXED","Need a public web server for SonarQube results","2017-04-10 10:30:18"
478986,"Ice","Website","denis.roy","RESOLVED","FIXED","Registering another email address with Gerrit fails","2016-10-24 12:08:25"
222148,"Incubator","e4","eclipse.e4-inbox","RESOLVED","INVALID","invalid bug","2008-03-10 20:34:48"
222677,"Incubator","e4","eclipse.e4-inbox","RESOLVED","FIXED","Fix thread leak","2008-03-14 15:10:10"
227555,"Incubator","e4","eclipse.e4-inbox","RESOLVED","FIXED","[EMF-Workbench] Change Multi-Inheritance to save resources","2008-04-17 10:34:07"
251384,"Incubator","e4","eclipse.e4-inbox","RESOLVED","WORKSFORME","Table#setFont() is not working (flex)","2019-09-04 01:50:46"
251386,"Incubator","e4","eclipse.e4-inbox","RESOLVED","WORKSFORME","Reordering columns in a Table is not ordering the content, only the header (flex)","2019-09-04 01:51:27"
251388,"Incubator","e4","eclipse.e4-inbox","RESOLVED","WORKSFORME","TableColumn#setWidth() not using pixels (flex)?","2019-09-04 01:50:42"
251389,"Incubator","e4","eclipse.e4-inbox","RESOLVED","WORKSFORME","SWT.CENTER not respected by TableColumn (flex)","2019-09-04 01:48:30"
251391,"Incubator","e4","eclipse.e4-inbox","RESOLVED","WORKSFORME","SortColumn, SortDirection, Selection non functional in TableColumn (flex)","2019-09-04 01:50:15"
251393,"Incubator","e4","eclipse.e4-inbox","RESOLVED","WORKSFORME","List#addAll() throws an Exception if sizes of Lists differ","2019-09-04 01:51:05"
251553,"Incubator","e4","eclipse.e4-inbox","RESOLVED","WORKSFORME","org.eclipse.swt.net is not on the classpath when running with win32 classpath","2019-09-04 01:53:22"
251671,"Incubator","e4","eclipse.e4-inbox","RESOLVED","WORKSFORME","Control.setMenu() has no effect (flex)","2019-09-04 01:48:48"
251849,"Incubator","e4","eclipse.e4-inbox","RESOLVED","WORKSFORME","event.item is null for Selection events (flex)","2019-09-04 01:50:36"
253957,"Incubator","e4","eclipse.e4-inbox","RESOLVED","WORKSFORME","(Desktop to Flex)  Adding underline to the shortcut key","2019-09-04 01:56:41"
265423,"Incubator","e4","eclipse.e4-inbox","RESOLVED","FIXED","Eclipse does not start in Debian Lenny","2009-02-23 06:38:06"
327736,"Incubator","e4","eclipse.e4-inbox","RESOLVED","WONTFIX","Make the e4 p2 repository (with e4 tools) self-contained","2010-10-14 09:29:45"
385428,"Incubator","e4","eclipse.e4-inbox","RESOLVED","WORKSFORME","E4 CSS editor has fixed size and doesn't follow preferences dialog size","2019-09-04 01:52:59"
385429,"Incubator","e4","eclipse.e4-inbox","RESOLVED","WORKSFORME","E4 CSS editor saves on cancel and warns about concurrent editing","2019-09-04 01:53:43"
436401,"Incubator","e4","eclipse.e4-inbox","RESOLVED","WORKSFORME","org.eclipse.e4.builder has tons of files without copyright","2019-09-04 01:52:00"
525839,"Incubator","e4","eclipse.e4-inbox","RESOLVED","WORKSFORME","breakpoints not working","2018-01-23 01:53:06"
581072,"Incubator","e4","eclipse.e4-inbox","RESOLVED","FIXED","Java postfix template ""fori"" and ""forr"" contain hardcoded variable name","2022-11-18 11:59:05"
581624,"Incubator","e4","eclipse.e4-inbox","RESOLVED","INVALID","Temurin builds won't load Apple KeychainStore certificates","2023-03-03 17:40:16"
581900,"Incubator","e4","eclipse.e4-inbox","RESOLVED","FIXED","eclipse flags statement as ""no effect""","2023-05-04 21:54:46"
582676,"Incubator","e4","eclipse.e4-inbox","RESOLVED","FIXED","Oops, something went wrong and we're completely broken down.","2023-11-28 05:15:17"
259296,"Incubator","e4","eclipse.felipe","RESOLVED","WORKSFORME","[FLEX]Dialogs support for Flex","2019-09-04 01:53:33"
259298,"Incubator","e4","eclipse.felipe","RESOLVED","WORKSFORME","[FLEX]TextEditor web port","2019-09-04 01:57:55"
259315,"Incubator","e4","eclipse.felipe","RESOLVED","WORKSFORME","[FLEX]new Toolbar  implementation (incomplete)","2019-09-04 01:53:33"
253910,"Incubator","e4","eric_hung","RESOLVED","WORKSFORME","[Flex] Display image in tool item","2019-09-04 01:52:43"
258692,"Incubator","e4","eric_hung","RESOLVED","FIXED","[Flex] Device Fonts","2008-12-18 11:23:25"
258696,"Incubator","e4","eric_hung","RESOLVED","FIXED","[Flex] ScrollBar for the CoolBar","2008-12-18 10:59:10"
258699,"Incubator","e4","eric_hung","RESOLVED","FIXED","[Flex] Decoration and Shell","2008-12-18 12:07:34"
249532,"Incubator","e4","gheorghe","RESOLVED","INVALID","toString() should not have override tag","2009-05-05 15:52:43"
456828,"Ice","General","ice-inbox","RESOLVED","FIXED","MOOSE - Setting MOOSE app throwing error in Windows","2015-01-06 16:49:49"
465629,"Ice","Core","ice-inbox","RESOLVED","WORKSFORME","MOOSE - Fork the stork button missing from nightly","2015-04-27 17:39:26"
469299,"Ice","Core","ice-inbox","RESOLVED","FIXED","Visualization File Viewer delete button does not work","2015-06-05 11:08:08"
469302,"Ice","Core","ice-inbox","RESOLVED","FIXED","CSV Plot Viewer cannot open plots","2015-06-05 11:07:52"
469304,"Ice","Core","ice-inbox","RESOLVED","INVALID","Cannot launch multiple simultaneous VisIt sessions","2015-06-05 08:49:24"
469305,"Ice","Core","ice-inbox","RESOLVED","FIXED","MOOSE Model Builder mouse wheel zoom function is inoperative","2015-06-05 11:07:31"
470834,"Ice","Core","ice-inbox","RESOLVED","FIXED","The New Item Wizard checks for null items twice","2015-06-26 08:38:40"
470838,"Ice","Core","ice-inbox","RESOLVED","WONTFIX","NekWriter doesn't use generic linebreaks","2015-06-26 15:22:01"
470844,"Ice","Core","ice-inbox","RESOLVED","FIXED","MeshAppState floating point equality comparision","2015-09-11 12:02:43"
470915,"Ice","Core","ice-inbox","RESOLVED","FIXED","MasterDetailsComponent uses bitwise AND instead of Boolean AND","2015-09-11 12:01:34"
471003,"Ice","Core","ice-inbox","RESOLVED","FIXED","Reflectivity model needs implementation","2015-10-28 16:44:39"
471345,"Ice","Core","ice-inbox","RESOLVED","FIXED","Visualization Perspective Add File Set option does not work","2015-09-10 14:34:13"
472202,"Ice","Core","ice-inbox","RESOLVED","FIXED","Number of Roughness Layers can be 1 in Reflectivity Model","2015-08-03 17:18:02"
472315,"Ice","Core","ice-inbox","RESOLVED","FIXED","Widget tests do not run in the Maven build","2015-07-10 15:24:15"
472380,"Ice","Core","ice-inbox","RESOLVED","FIXED","SWTBot Test Failures","2015-09-08 15:39:35"
475915,"Ice","Core","ice-inbox","RESOLVED","FIXED","Viz bundles depend on org.eclise.ice.datastructures","2015-09-08 13:18:12"
476577,"Ice","Core","ice-inbox","RESOLVED","FIXED","""Import existing files into the workspace"" function not working","2015-09-10 10:57:50"
478177,"Ice","Core","ice-inbox","RESOLVED","FIXED","Adding a MultiLauncher Item fails with no error message","2015-11-09 11:12:39"
481432,"Ice","Core","ice-inbox","RESOLVED","FIXED","Threading Options for Job Profile Editor multiply","2015-11-04 17:55:44"
455536,"Ice","Core","jayjaybillings","RESOLVED","FIXED","Unit tests not cleaning up after themselves after failing, causing subsequent runs to fail","2014-12-17 17:32:33"
467264,"Ice","Core","jayjaybillings","RESOLVED","DUPLICATE","Viz refactor: MOOSE blocks don't have checkboxes","2015-05-15 15:52:05"
467271,"Ice","Core","jayjaybillings","RESOLVED","DUPLICATE","Viz refactor: Not all resources being added to ResourceComponent when VisIt connection not set","2015-05-15 18:26:27"
471603,"Ice","Core","jayjaybillings","RESOLVED","FIXED","Eclipse MarketPlace not in Toolbar menu","2015-09-08 16:11:24"
389958,"Incubator","e4","jdt-debug-inbox","RESOLVED","WORKSFORME","Ubuntu Linux 12.04","2018-09-14 01:49:38"
468387,"Ice","Core","jordan.deyton","RESOLVED","FIXED","File Entry Composite Improvements","2015-06-18 13:42:23"
469932,"Ice","Core","jordan.deyton","RESOLVED","FIXED","Checking parent tree node check box does not select its children check boxes","2015-06-11 12:32:56"
469934,"Ice","Core","jordan.deyton","RESOLVED","FIXED","More feedback is needed when establishing a VisIt connection","2015-06-11 12:38:34"
470306,"Ice","General","jordan.deyton","RESOLVED","FIXED","Visualization Service - Create a general Plot Editor","2015-09-11 12:05:23"
470427,"Ice","Core","jordan.deyton","RESOLVED","FIXED","Right clicking models gives extraneous options","2015-09-11 12:04:00"
470752,"Ice","Core","jordan.deyton","RESOLVED","DUPLICATE","ParaViewVizService - Incorporate new time slider widget","2015-07-23 17:38:09"
475606,"Ice","Core","jordan.deyton","RESOLVED","FIXED","ICE UI - Empty Viewers when using GTK3","2015-11-09 11:18:43"
238351,"Incubator","e4","Kevin_McGuire","RESOLVED","WORKSFORME","e4 web demo no longer works on 3.4","2019-09-04 01:50:57"
226182,"Incubator","e4","maxime_daniel","RESOLVED","FIXED","[eca] java.lang.Object methods in interfaces","2008-04-10 03:50:27"
226188,"Incubator","e4","maxime_daniel","RESOLVED","FIXED","[eca] wrong accessor for static field","2008-04-10 05:34:06"
226193,"Incubator","e4","maxime_daniel","RESOLVED","FIXED","[eca] inner class messes up context","2008-05-02 10:24:05"
226465,"Incubator","e4","maxime_daniel","RESOLVED","FIXED","[eca] wrong synthetics combination","2008-05-05 05:31:38"
227786,"Incubator","e4","maxime_daniel","RESOLVED","FIXED","[eca] template supports  (java 1.5)","2008-05-02 04:12:41"
227787,"Incubator","e4","maxime_daniel","RESOLVED","FIXED","[eca] annotations support (java 1.5)","2008-04-30 08:25:07"
227846,"Incubator","e4","maxime_daniel","RESOLVED","FIXED","[eca] bug with inner class involving local names registry","2008-05-02 08:20:24"
248647,"Incubator","e4","Olivier_Thomann","RESOLVED","WONTFIX","try..catch (NullPointerException)  doesn't work","2010-03-05 15:32:43"
249537,"Incubator","e4","Olivier_Thomann","RESOLVED","FIXED","ActionScript files should not change visibility of methods","2008-10-15 10:27:07"
251862,"Incubator","e4","Olivier_Thomann","RESOLVED","FIXED","Stack overflow in Java->AS compiler","2008-10-29 10:58:24"
252605,"Incubator","e4","Olivier_Thomann","RESOLVED","FIXED","Unable to assign a value to a field from an anonymous inner class (flex)","2008-11-03 13:24:55"
249509,"Incubator","e4","Silenio_Quarti","RESOLVED","WONTFIX","Integer.decode(String) doesn't seem to work at runtime","2012-06-20 21:11:59"
473531,"Ice","Core","smithrw","RESOLVED","FIXED","ICE geometry classes need to be refactor to use the IVizService infrastructure","2015-09-08 15:36:37"
476974,"Ice","Core","smithrw","RESOLVED","FIXED","PlotGridCompositeTester Fails on Mac","2015-10-06 15:42:04"
476994,"Ice","Core","smithrw","RESOLVED","FIXED","PlotDialogProvider Adds IPlots that are Null","2015-09-09 12:45:55"
477462,"Ice","Core","smithrw","RESOLVED","FIXED","CSV Plot Editor Cannot Set Independent Series","2015-09-16 12:14:17"
226379,"Incubator","e4","tom.schindl","RESOLVED","FIXED","[EMF-Workbench] Workbench with an EMF-Model below","2008-04-17 10:33:35"
227552,"Incubator","e4","tom.schindl","RESOLVED","FIXED","[EMF-Workbench] Use booleans and int instead of Boolean and Integer in the EMF metamodel","2008-04-17 13:33:15"
228735,"Incubator","e4","tom.schindl","RESOLVED","FIXED","[EMF-Workbench] Make EMF-Objects Scriptable use Rhino ScritableObject","2008-04-24 15:06:17"
454427,"Ice","General","wojtowicza","RESOLVED","FIXED","ICE Moose Launching Dynamic File Presentation support","2014-12-29 13:32:26"
454647,"Ice","General","wojtowicza","RESOLVED","FIXED","MOOSE YAML/action syntax generator appending subsequent data","2014-12-09 17:12:38"
457637,"Ice","Website","wojtowicza","RESOLVED","FIXED","Update MOOSE tutorial to use new YAML generator wizard","2015-01-15 17:49:07"
459332,"Ice","Core","ice-inbox","CLOSED","FIXED","Remote launch with private key and optional credentials","2015-07-31 16:04:51"
459333,"Ice","Core","ice-inbox","CLOSED","FIXED","Remote launch should allow for the use of a proxy","2015-07-31 16:01:05"
458173,"Ice","Core","wojtowicza","CLOSED","FIXED","Windows build failing in ItemTester package","2015-05-20 13:59:40"
